<?xml version="1.0" encoding="UTF-8"?>

<alumnos xmlns:xs="http://www.w3.org/2001/XMLSchema-instance" xs:noNamespaceSchemaLocation="/home/diurno/Escritorio/html%20Lenguaje%20de%20Marcas/Tema%205/Validacion/xsd/EjercicioFinalDefinicionDatosXSD.xsd">

    <alumno>

        <nombre>Rafael</nombre>
        <apellidos>Nadal</apellidos>

        <direccion>

            <domicilio>C/ Ancha</domicilio>
            <codigo_postal>10004</codigo_postal>
            <localidad>Cáceres</localidad>
            <provincia>Cáceres</provincia>

        </direccion>

        <contactar>

            <telf_casa>927242424</telf_casa>
            <telf_movil>64444444</telf_movil>
            <telf_trabajo>927111111</telf_trabajo>
            <telf_trabajo>927222222</telf_trabajo>
            <email>rafael@gmail.com</email>

        </contactar>

    </alumno>

    <alumno>

        <nombre>Fernando</nombre>
        <apellidos>Alonso Díaz</apellidos>

        <direccion>

            <domicilio>C/ Victoria</domicilio>
            <codigo_postal>10033</codigo_postal>
            <localidad>Cáceres</localidad>
            <provincia>Cáceres</provincia>

        </direccion>

        <contactar>

            <telf_casa>927252525</telf_casa>
            <telf_movil>644555555</telf_movil>
            <telf_trabajo>927333333</telf_trabajo>
            <telf_trabajo>927444444</telf_trabajo>
            <email>fernando@gmail.com</email>

        </contactar>

    </alumno>

</alumnos>